attributeName,attributeDefinition,formatString,definition,unit,numberType,type,factor
plot,ID of the plot,NA,area_plot number within area,NA,NA,character,NA
area,ID of the area,NA,ID of the area,NA,NA,character,NA
subplot,ID of the subplot for flower investigations: three 1 m² subplots in each plot,NA,plot_subplot number within plot,NA,NA,character,NA
treatment,cutting time,NA,early: mid June;  late: mid September,NA,NA,character,early;late
numb.flow.spec,number of flowering plant species,NA,NA,dimensionless,integer,numeric,NA
numb.spec,number of species,NA,NA,dimensionless,integer,numeric,NA
month,time of data collection (always in the beginning of the month),NA,NA,NA,NA,factor,May;June;July;August;September
